{
  "schema_version": 1,
  "id": "shader-only-preservation",
  "status": "verified",
  "applies_to": ["mu:monster:monster03"],
  "finding": "A material-only candidate can be proven independent from mesh/rig changes only when structure, UVs, weights, actions, packed images and material identity are fingerprinted separately.",
  "guidance": "Clone the inherited material, retain base-color and normal-map links, change only named scalar shader controls, and render the same turntable under the same lighting. Require a preservation report before evaluating the look. Do not treat a material study as approval of unresolved topology, animation, LOD or target-runtime issues.",
  "evidence": ["catalog/runs/monster03-v0002-body-pbr-calibration-20261019.json", "work/monster03/body-material-preservation.json", "work/monster03/body-probe/body-pbr-comparison.png"],
  "superseded_by": null
}
